{
  "$schema": "https://json-schema.org/draft/2020-12/schema",
  "$id": "material.schema.json",
  "title": "Rune material",
  "type": "object",
  "properties": {
    "$schema": { "type": "string" },
    "surface_shader": {
      "type": "string",
      "minLength": 1,
      "description": "Project-relative r3d surface hook GLSL. Define void fragment() and/or void vertex(). The bridge owns the compiled shader and reloads it when its source changes."
    },
    "surface_shader_time": {
      "type": "boolean",
      "default": false,
      "description": "Supply float u_time in elapsed seconds to surface_shader each draw. Scene3D_Settings can override this clock for pausing and deterministic captures."
    },
    "procedural": {
      "type": "object",
      "description": "Generate seamless UV-space noise maps at load time. File textures override their corresponding generated maps. Save this file to regenerate through material hot reload.",
      "additionalProperties": false,
      "properties": {
        "enabled": { "type": "boolean", "default": true },
        "pattern": { "type": "string", "enum": ["noise", "wood"], "default": "noise", "description": "Layered noise or wood grain bands warped by seamless noise." },
        "resolution": { "type": "integer", "enum": [8, 16, 32, 64, 128, 256, 512, 1024], "default": 256, "description": "Width and height of generated maps in pixels." },
        "seed": { "type": "integer", "minimum": 0, "maximum": 65535, "default": 0, "description": "Repeatable noise seed." },
        "scale": { "type": "integer", "minimum": 1, "maximum": 64, "default": 8, "description": "Noise cells per UV tile. Higher values give smaller features." },
        "octaves": { "type": "integer", "minimum": 1, "maximum": 6, "default": 4, "description": "Noise detail layers. Layers finer than two pixels are omitted." },
        "persistence": { "type": "number", "minimum": 0, "maximum": 1, "default": 0.5, "description": "Contribution of each successive detail layer." },
        "contrast": { "type": "number", "minimum": 0.1, "maximum": 8, "default": 1, "description": "Contrast of the shared noise field." },
        "color_a": { "type": "array", "items": { "type": "integer", "minimum": 0, "maximum": 255 }, "minItems": 4, "maxItems": 4, "default": [65,70,76,255], "description": "RGBA color at noise value zero, multiplied by base_color." },
        "color_b": { "type": "array", "items": { "type": "integer", "minimum": 0, "maximum": 255 }, "minItems": 4, "maxItems": 4, "default": [190,195,200,255], "description": "RGBA color at noise value one, multiplied by base_color." },
        "bump_strength": { "type": "number", "minimum": 0, "maximum": 2, "default": 0.15, "description": "Height-to-normal strength. Zero disables generated normals; normal_scale also applies." },
        "roughness_variation": { "type": "number", "minimum": 0, "maximum": 1, "default": 0.3, "description": "Noise modulation of scalar roughness from roughness*(1-variation) to roughness. Zero disables the generated ORM map. Any file-based ORM channel overrides generated ORM." }
      }
    },
    "base_color": {
      "type": "array",
      "description": "RGBA color multiplied into the rendered model or primitive.",
      "items": { "type": "integer", "minimum": 0, "maximum": 255 },
      "minItems": 4,
      "maxItems": 4,
      "default": [255, 255, 255, 255]
    },
    "texture": {
      "type": "string",
      "description": "Project-relative diffuse/albedo texture path. Kept as an alias for albedo."
    },
    "albedo": {
      "type": "string",
      "description": "Project-relative diffuse/albedo texture path."
    },
    "normal": {
      "type": "string",
      "description": "Project-relative tangent-space normal map path."
    },
    "normal_scale": {
      "type": "number",
      "description": "Normal map strength multiplier from 0 to 4.",
      "minimum": 0,
      "maximum": 4,
      "default": 1
    },
    "emission": {
      "type": "string",
      "description": "Project-relative emission texture path. Alias for emission_texture."
    },
    "emission_texture": {
      "type": "string",
      "description": "Project-relative emission texture path."
    },
    "emission_color": {
      "type": "array",
      "description": "RGBA color multiplied into emission.",
      "items": { "type": "integer", "minimum": 0, "maximum": 255 },
      "minItems": 4,
      "maxItems": 4,
      "default": [255, 255, 255, 255]
    },
    "emission_energy": {
      "type": "number",
      "description": "Emission strength multiplier.",
      "minimum": 0,
      "default": 0
    },
    "orm_texture": {
      "type": "string",
      "description": "Project-relative packed occlusion/roughness/metallic texture path. R=AO, G=roughness, B=metallic."
    },
    "orm": {
      "type": "string",
      "description": "Alias for orm_texture."
    },
    "roughness_texture": {
      "type": "string",
      "description": "Project-relative roughness texture path. The red channel is sampled."
    },
    "metallic_texture": {
      "type": "string",
      "description": "Project-relative metallic texture path. The red channel is sampled."
    },
    "ao_texture": {
      "type": "string",
      "description": "Project-relative ambient occlusion texture path. The red channel darkens ambient light."
    },
    "ao_strength": {
      "type": "number",
      "description": "Ambient occlusion strength multiplier from 0 to 1.",
      "minimum": 0,
      "maximum": 1,
      "default": 1
    },
    "occlusion": {
      "type": "string",
      "description": "Alias for ao_texture."
    },
    "height_texture": {
      "type": "string",
      "description": "Project-relative height texture path reserved for custom/parallax material shaders. The r3d default material does not consume this yet."
    },
    "height": {
      "type": "string",
      "description": "Alias for height_texture."
    },
    "filter": {
      "type": "string",
      "description": "Sampling filter for material textures. Use point with mipmaps false for sharp, unsmoothed retro pixels.",
      "enum": ["point", "bilinear", "trilinear", "anisotropic_4x", "anisotropic_8x", "anisotropic_16x"],
      "default": "anisotropic_8x"
    },
    "mipmaps": {
      "type": "boolean",
      "description": "Generate mipmaps before applying the texture filter.",
      "default": true
    },
    "lod_bias": {
      "type": "number",
      "description": "Positive mip LOD bias for noisy textures; higher values sample softer mip levels.",
      "minimum": 0,
      "maximum": 4,
      "default": 0
    },
    "lighting": {
      "type": "boolean",
      "description": "Whether the material participates in r3d lighting.",
      "default": false
    },
    "roughness": {
      "type": "number",
      "description": "Lit material roughness from 0 to 1.",
      "minimum": 0,
      "maximum": 1,
      "default": 0.5
    },
    "metallic": {
      "type": "number",
      "description": "Lit material metallic response from 0 to 1.",
      "minimum": 0,
      "maximum": 1,
      "default": 0
    },
    "specular": {
      "type": "number",
      "description": "Base reflectivity multiplier for non-metal materials from 0 to 1.",
      "minimum": 0,
      "maximum": 1,
      "default": 0.5
    },
    "alpha_cutoff": {
      "type": "number",
      "description": "Alpha cutoff threshold from 0 to 1.",
      "minimum": 0,
      "maximum": 1,
      "default": 0.01
    },
    "transparency": {
      "type": "string",
      "description": "Transparency rendering mode.",
      "enum": ["disabled", "prepass", "alpha"],
      "default": "disabled"
    },
    "blend": {
      "type": "string",
      "description": "Blend mode used when transparency is active.",
      "enum": ["mix", "additive", "multiply", "premultiplied_alpha"],
      "default": "mix"
    },
    "cull": {
      "type": "string",
      "description": "Face culling mode.",
      "enum": ["back", "front", "none"],
      "default": "back"
    },
    "billboard": {
      "type": "string",
      "description": "Camera alignment. front faces the camera fully; y_axis preserves world up. Use MeshRenderer quad for an upright textured card.",
      "enum": ["disabled", "front", "y_axis"],
      "default": "disabled"
    },
    "height_scale": {
      "type": "number",
      "description": "Height/parallax scale reserved for custom material shaders. The r3d default material does not consume this yet.",
      "minimum": 0,
      "maximum": 0.2,
      "default": 0.03
    }
  },
  "additionalProperties": false
}
