{
  "$schema": "../../../../schemas/material.schema.json",
  "base_color": [255, 255, 255, 255],
  "albedo": "assets/textures/basecolor.png",
  "normal": "assets/textures/normal.png",
  "normal_scale": 1.1,
  "roughness_texture": "assets/textures/roughness.png",
  "ao_texture": "assets/textures/ambientOcclusion.png",
  "ao_strength": 1,
  "height_texture": "assets/textures/height.png",
  "height_scale": 0.015,
  "emission_color": [255, 255, 255, 255],
  "emission_energy": 0,
  "filter": "anisotropic_16x",
  "mipmaps": true,
  "lighting": true,
  "roughness": 0.7,
  "metallic": 0,
  "specular": 0.35,
  "alpha_cutoff": 0.01,
  "transparency": "disabled",
  "blend": "mix",
  "cull": "back"
}
